{
  "id": "675afd85-0e61-493e-a1cb-3a2eae468cb8",
  "name": "silk coffee, soymilk",
  "aliases": [],
  "category": "Legumes and Legume Products",
  "origin": "",
  "overall_safety_score": null,
  "health_index": null,
  "ban_listed": false,
  "image_url": "",
  "metadata": {
    "source": "USDA FoodData Central",
    "usda_fdc_id": 175224,
    "data_type": "SR Legacy",
    "source_url": "https://fdc.nal.usda.gov/fdc-app.html#/food-details/175224/nutrients"
  },
  "molecules": [
    {
      "molecule_name": "Proximates",
      "amount_per_100g": null,
      "unit": "g",
      "amount_notes": "Auto-imported from USDA FoodData Central",
      "is_beneficial": true
    },
    {
      "molecule_name": "Energy",
      "amount_per_100g": 62.0,
      "unit": "kcal",
      "amount_notes": "Auto-imported from USDA FoodData Central",
      "is_beneficial": true
    },
    {
      "molecule_name": "Energy",
      "amount_per_100g": 259.0,
      "unit": "kJ",
      "amount_notes": "Auto-imported from USDA FoodData Central",
      "is_beneficial": true
    },
    {
      "molecule_name": "Protein",
      "amount_per_100g": 2.06,
      "unit": "g",
      "amount_notes": "Auto-imported from USDA FoodData Central",
      "is_beneficial": true
    },
    {
      "molecule_name": "Total lipid (fat)",
      "amount_per_100g": 1.44,
      "unit": "g",
      "amount_notes": "Auto-imported from USDA FoodData Central",
      "is_beneficial": true
    },
    {
      "molecule_name": "Carbohydrates",
      "amount_per_100g": null,
      "unit": "g",
      "amount_notes": "Auto-imported from USDA FoodData Central",
      "is_beneficial": true
    },
    {
      "molecule_name": "Carbohydrate, by difference",
      "amount_per_100g": 10.29,
      "unit": "g",
      "amount_notes": "Auto-imported from USDA FoodData Central",
      "is_beneficial": true
    },
    {
      "molecule_name": "Fiber, total dietary",
      "amount_per_100g": 0.0,
      "unit": "g",
      "amount_notes": "Auto-imported from USDA FoodData Central",
      "is_beneficial": true
    },
    {
      "molecule_name": "Total Sugars",
      "amount_per_100g": 9.47,
      "unit": "g",
      "amount_notes": "Auto-imported from USDA FoodData Central",
      "is_beneficial": true
    },
    {
      "molecule_name": "Minerals",
      "amount_per_100g": null,
      "unit": "mg",
      "amount_notes": "Auto-imported from USDA FoodData Central",
      "is_beneficial": true
    },
    {
      "molecule_name": "Calcium, Ca",
      "amount_per_100g": 123.0,
      "unit": "mg",
      "amount_notes": "Auto-imported from USDA FoodData Central",
      "is_beneficial": true
    },
    {
      "molecule_name": "Iron, Fe",
      "amount_per_100g": 0.0,
      "unit": "mg",
      "amount_notes": "Auto-imported from USDA FoodData Central",
      "is_beneficial": true
    },
    {
      "molecule_name": "Magnesium, Mg",
      "amount_per_100g": 0.0,
      "unit": "mg",
      "amount_notes": "Auto-imported from USDA FoodData Central",
      "is_beneficial": true
    },
    {
      "molecule_name": "Potassium, K",
      "amount_per_100g": 132.0,
      "unit": "mg",
      "amount_notes": "Auto-imported from USDA FoodData Central",
      "is_beneficial": true
    },
    {
      "molecule_name": "Sodium, Na",
      "amount_per_100g": 41.0,
      "unit": "mg",
      "amount_notes": "Auto-imported from USDA FoodData Central",
      "is_beneficial": true
    },
    {
      "molecule_name": "Zinc, Zn",
      "amount_per_100g": 0.37,
      "unit": "mg",
      "amount_notes": "Auto-imported from USDA FoodData Central",
      "is_beneficial": true
    },
    {
      "molecule_name": "Selenium, Se",
      "amount_per_100g": 0.0,
      "unit": "\u00b5g",
      "amount_notes": "Auto-imported from USDA FoodData Central",
      "is_beneficial": true
    },
    {
      "molecule_name": "Vitamins and Other Components",
      "amount_per_100g": null,
      "unit": "g",
      "amount_notes": "Auto-imported from USDA FoodData Central",
      "is_beneficial": true
    },
    {
      "molecule_name": "Vitamin C, total ascorbic acid",
      "amount_per_100g": 0.0,
      "unit": "mg",
      "amount_notes": "Auto-imported from USDA FoodData Central",
      "is_beneficial": true
    },
    {
      "molecule_name": "Riboflavin",
      "amount_per_100g": 0.21,
      "unit": "mg",
      "amount_notes": "Auto-imported from USDA FoodData Central",
      "is_beneficial": true
    },
    {
      "molecule_name": "Folate, total",
      "amount_per_100g": 7.0,
      "unit": "\u00b5g",
      "amount_notes": "Auto-imported from USDA FoodData Central",
      "is_beneficial": true
    },
    {
      "molecule_name": "Folate, food",
      "amount_per_100g": 7.0,
      "unit": "\u00b5g",
      "amount_notes": "Auto-imported from USDA FoodData Central",
      "is_beneficial": true
    },
    {
      "molecule_name": "Vitamin B-12",
      "amount_per_100g": 0.37,
      "unit": "\u00b5g",
      "amount_notes": "Auto-imported from USDA FoodData Central",
      "is_beneficial": true
    },
    {
      "molecule_name": "Vitamin A, IU",
      "amount_per_100g": 123.0,
      "unit": "IU",
      "amount_notes": "Auto-imported from USDA FoodData Central",
      "is_beneficial": true
    },
    {
      "molecule_name": "Lipids",
      "amount_per_100g": null,
      "unit": "g",
      "amount_notes": "Auto-imported from USDA FoodData Central",
      "is_beneficial": true
    },
    {
      "molecule_name": "Fatty acids, total saturated",
      "amount_per_100g": 0.206,
      "unit": "g",
      "amount_notes": "Auto-imported from USDA FoodData Central",
      "is_beneficial": true
    },
    {
      "molecule_name": "Fatty acids, total trans",
      "amount_per_100g": 0.0,
      "unit": "g",
      "amount_notes": "Auto-imported from USDA FoodData Central",
      "is_beneficial": true
    },
    {
      "molecule_name": "Cholesterol",
      "amount_per_100g": 0.0,
      "unit": "mg",
      "amount_notes": "Auto-imported from USDA FoodData Central",
      "is_beneficial": true
    }
  ]
}