{
  "id": "ba673115-ed3b-4955-addf-de78ccf7f3fb",
  "name": "beans, snap, green, raw",
  "aliases": [],
  "category": "Vegetables and Vegetable Products",
  "origin": "",
  "overall_safety_score": null,
  "health_index": null,
  "ban_listed": false,
  "image_url": "",
  "metadata": {
    "source": "USDA FoodData Central",
    "usda_fdc_id": 2346400,
    "data_type": "Foundation",
    "source_url": "https://fdc.nal.usda.gov/fdc-app.html#/food-details/2346400/nutrients"
  },
  "molecules": [
    {
      "molecule_name": "Proximates",
      "amount_per_100g": null,
      "unit": "g",
      "amount_notes": "Auto-imported from USDA FoodData Central",
      "is_beneficial": true
    },
    {
      "molecule_name": "Energy (Atwater General Factors)",
      "amount_per_100g": 39.9998,
      "unit": "kcal",
      "amount_notes": "Auto-imported from USDA FoodData Central",
      "is_beneficial": true
    },
    {
      "molecule_name": "Energy (Atwater Specific Factors)",
      "amount_per_100g": 33.5679465,
      "unit": "kcal",
      "amount_notes": "Auto-imported from USDA FoodData Central",
      "is_beneficial": true
    },
    {
      "molecule_name": "Protein",
      "amount_per_100g": 1.96875,
      "unit": "g",
      "amount_notes": "Auto-imported from USDA FoodData Central",
      "is_beneficial": true
    },
    {
      "molecule_name": "Total lipid (fat)",
      "amount_per_100g": 0.275,
      "unit": "g",
      "amount_notes": "Auto-imported from USDA FoodData Central",
      "is_beneficial": true
    },
    {
      "molecule_name": "Carbohydrates",
      "amount_per_100g": null,
      "unit": "g",
      "amount_notes": "Auto-imported from USDA FoodData Central",
      "is_beneficial": true
    },
    {
      "molecule_name": "Carbohydrate, by difference",
      "amount_per_100g": 7.41245,
      "unit": "g",
      "amount_notes": "Auto-imported from USDA FoodData Central",
      "is_beneficial": true
    },
    {
      "molecule_name": "Fiber, total dietary",
      "amount_per_100g": 3.011,
      "unit": "g",
      "amount_notes": "Auto-imported from USDA FoodData Central",
      "is_beneficial": true
    },
    {
      "molecule_name": "Sugars, Total",
      "amount_per_100g": 2.3338,
      "unit": "g",
      "amount_notes": "Auto-imported from USDA FoodData Central",
      "is_beneficial": true
    },
    {
      "molecule_name": "Sucrose",
      "amount_per_100g": 0.0775,
      "unit": "g",
      "amount_notes": "Auto-imported from USDA FoodData Central",
      "is_beneficial": true
    },
    {
      "molecule_name": "Glucose",
      "amount_per_100g": 1.33,
      "unit": "g",
      "amount_notes": "Auto-imported from USDA FoodData Central",
      "is_beneficial": true
    },
    {
      "molecule_name": "Fructose",
      "amount_per_100g": 0.9263,
      "unit": "g",
      "amount_notes": "Auto-imported from USDA FoodData Central",
      "is_beneficial": true
    },
    {
      "molecule_name": "Lactose",
      "amount_per_100g": 0.0,
      "unit": "g",
      "amount_notes": "Auto-imported from USDA FoodData Central",
      "is_beneficial": true
    },
    {
      "molecule_name": "Maltose",
      "amount_per_100g": 0.0,
      "unit": "g",
      "amount_notes": "Auto-imported from USDA FoodData Central",
      "is_beneficial": true
    },
    {
      "molecule_name": "Minerals",
      "amount_per_100g": null,
      "unit": "mg",
      "amount_notes": "Auto-imported from USDA FoodData Central",
      "is_beneficial": true
    },
    {
      "molecule_name": "Calcium, Ca",
      "amount_per_100g": 40.05,
      "unit": "mg",
      "amount_notes": "Auto-imported from USDA FoodData Central",
      "is_beneficial": true
    },
    {
      "molecule_name": "Iron, Fe",
      "amount_per_100g": 0.6516,
      "unit": "mg",
      "amount_notes": "Auto-imported from USDA FoodData Central",
      "is_beneficial": true
    },
    {
      "molecule_name": "Magnesium, Mg",
      "amount_per_100g": 28.21,
      "unit": "mg",
      "amount_notes": "Auto-imported from USDA FoodData Central",
      "is_beneficial": true
    },
    {
      "molecule_name": "Phosphorus, P",
      "amount_per_100g": 41.15,
      "unit": "mg",
      "amount_notes": "Auto-imported from USDA FoodData Central",
      "is_beneficial": true
    },
    {
      "molecule_name": "Potassium, K",
      "amount_per_100g": 290.4,
      "unit": "mg",
      "amount_notes": "Auto-imported from USDA FoodData Central",
      "is_beneficial": true
    },
    {
      "molecule_name": "Sodium, Na",
      "amount_per_100g": 0.0,
      "unit": "mg",
      "amount_notes": "Auto-imported from USDA FoodData Central",
      "is_beneficial": true
    },
    {
      "molecule_name": "Zinc, Zn",
      "amount_per_100g": 0.3498,
      "unit": "mg",
      "amount_notes": "Auto-imported from USDA FoodData Central",
      "is_beneficial": true
    },
    {
      "molecule_name": "Copper, Cu",
      "amount_per_100g": 0.09829,
      "unit": "mg",
      "amount_notes": "Auto-imported from USDA FoodData Central",
      "is_beneficial": true
    },
    {
      "molecule_name": "Manganese, Mn",
      "amount_per_100g": 0.3324,
      "unit": "mg",
      "amount_notes": "Auto-imported from USDA FoodData Central",
      "is_beneficial": true
    },
    {
      "molecule_name": "Molybdenum, Mo",
      "amount_per_100g": 41.63,
      "unit": "\u00b5g",
      "amount_notes": "Auto-imported from USDA FoodData Central",
      "is_beneficial": true
    },
    {
      "molecule_name": "Vitamins and Other Components",
      "amount_per_100g": null,
      "unit": "g",
      "amount_notes": "Auto-imported from USDA FoodData Central",
      "is_beneficial": true
    },
    {
      "molecule_name": "Thiamin",
      "amount_per_100g": 0.06,
      "unit": "mg",
      "amount_notes": "Auto-imported from USDA FoodData Central",
      "is_beneficial": true
    },
    {
      "molecule_name": "Niacin",
      "amount_per_100g": 0.7313,
      "unit": "mg",
      "amount_notes": "Auto-imported from USDA FoodData Central",
      "is_beneficial": true
    },
    {
      "molecule_name": "Vitamin B-6",
      "amount_per_100g": 0.121,
      "unit": "mg",
      "amount_notes": "Auto-imported from USDA FoodData Central",
      "is_beneficial": true
    },
    {
      "molecule_name": "Vitamin K (phylloquinone)",
      "amount_per_100g": 43.9,
      "unit": "\u00b5g",
      "amount_notes": "Auto-imported from USDA FoodData Central",
      "is_beneficial": true
    },
    {
      "molecule_name": "Vitamin K (Dihydrophylloquinone)",
      "amount_per_100g": 0.0,
      "unit": "\u00b5g",
      "amount_notes": "Auto-imported from USDA FoodData Central",
      "is_beneficial": true
    },
    {
      "molecule_name": "Vitamin K (Menaquinone-4)",
      "amount_per_100g": 0.0,
      "unit": "\u00b5g",
      "amount_notes": "Auto-imported from USDA FoodData Central",
      "is_beneficial": true
    }
  ]
}