{
  "id": "269796ad-40fe-4d4f-81cc-7b46d01a0c48",
  "name": "yachtwurst, with pistachio nuts, cooked",
  "aliases": [],
  "category": "Sausages and Luncheon Meats",
  "origin": "",
  "overall_safety_score": null,
  "health_index": null,
  "ban_listed": false,
  "image_url": "",
  "metadata": {
    "source": "USDA FoodData Central",
    "usda_fdc_id": 172960,
    "data_type": "SR Legacy",
    "source_url": "https://fdc.nal.usda.gov/fdc-app.html#/food-details/172960/nutrients"
  },
  "molecules": [
    {
      "molecule_name": "Proximates",
      "amount_per_100g": null,
      "unit": "g",
      "amount_notes": "Auto-imported from USDA FoodData Central",
      "is_beneficial": true
    },
    {
      "molecule_name": "Energy",
      "amount_per_100g": 268.0,
      "unit": "kcal",
      "amount_notes": "Auto-imported from USDA FoodData Central",
      "is_beneficial": true
    },
    {
      "molecule_name": "Energy",
      "amount_per_100g": 1121.0,
      "unit": "kJ",
      "amount_notes": "Auto-imported from USDA FoodData Central",
      "is_beneficial": true
    },
    {
      "molecule_name": "Protein",
      "amount_per_100g": 14.8,
      "unit": "g",
      "amount_notes": "Auto-imported from USDA FoodData Central",
      "is_beneficial": true
    },
    {
      "molecule_name": "Total lipid (fat)",
      "amount_per_100g": 22.6,
      "unit": "g",
      "amount_notes": "Auto-imported from USDA FoodData Central",
      "is_beneficial": true
    },
    {
      "molecule_name": "Carbohydrates",
      "amount_per_100g": null,
      "unit": "g",
      "amount_notes": "Auto-imported from USDA FoodData Central",
      "is_beneficial": true
    },
    {
      "molecule_name": "Carbohydrate, by difference",
      "amount_per_100g": 1.4,
      "unit": "g",
      "amount_notes": "Auto-imported from USDA FoodData Central",
      "is_beneficial": true
    },
    {
      "molecule_name": "Fiber, total dietary",
      "amount_per_100g": 0.0,
      "unit": "g",
      "amount_notes": "Auto-imported from USDA FoodData Central",
      "is_beneficial": true
    },
    {
      "molecule_name": "Total Sugars",
      "amount_per_100g": 0.0,
      "unit": "g",
      "amount_notes": "Auto-imported from USDA FoodData Central",
      "is_beneficial": true
    },
    {
      "molecule_name": "Minerals",
      "amount_per_100g": null,
      "unit": "mg",
      "amount_notes": "Auto-imported from USDA FoodData Central",
      "is_beneficial": true
    },
    {
      "molecule_name": "Calcium, Ca",
      "amount_per_100g": 19.0,
      "unit": "mg",
      "amount_notes": "Auto-imported from USDA FoodData Central",
      "is_beneficial": true
    },
    {
      "molecule_name": "Iron, Fe",
      "amount_per_100g": 1.0,
      "unit": "mg",
      "amount_notes": "Auto-imported from USDA FoodData Central",
      "is_beneficial": true
    },
    {
      "molecule_name": "Sodium, Na",
      "amount_per_100g": 936.0,
      "unit": "mg",
      "amount_notes": "Auto-imported from USDA FoodData Central",
      "is_beneficial": true
    },
    {
      "molecule_name": "Vitamins and Other Components",
      "amount_per_100g": null,
      "unit": "g",
      "amount_notes": "Auto-imported from USDA FoodData Central",
      "is_beneficial": true
    },
    {
      "molecule_name": "Vitamin C, total ascorbic acid",
      "amount_per_100g": 0.0,
      "unit": "mg",
      "amount_notes": "Auto-imported from USDA FoodData Central",
      "is_beneficial": true
    },
    {
      "molecule_name": "Vitamin A, RAE",
      "amount_per_100g": 0.0,
      "unit": "\u00b5g",
      "amount_notes": "Auto-imported from USDA FoodData Central",
      "is_beneficial": true
    },
    {
      "molecule_name": "Retinol",
      "amount_per_100g": 0.0,
      "unit": "\u00b5g",
      "amount_notes": "Auto-imported from USDA FoodData Central",
      "is_beneficial": true
    },
    {
      "molecule_name": "Carotene, beta",
      "amount_per_100g": 0.0,
      "unit": "\u00b5g",
      "amount_notes": "Auto-imported from USDA FoodData Central",
      "is_beneficial": true
    },
    {
      "molecule_name": "Carotene, alpha",
      "amount_per_100g": 0.0,
      "unit": "\u00b5g",
      "amount_notes": "Auto-imported from USDA FoodData Central",
      "is_beneficial": true
    },
    {
      "molecule_name": "Cryptoxanthin, beta",
      "amount_per_100g": 0.0,
      "unit": "\u00b5g",
      "amount_notes": "Auto-imported from USDA FoodData Central",
      "is_beneficial": true
    },
    {
      "molecule_name": "Vitamin A, IU",
      "amount_per_100g": 0.0,
      "unit": "IU",
      "amount_notes": "Auto-imported from USDA FoodData Central",
      "is_beneficial": true
    },
    {
      "molecule_name": "Lycopene",
      "amount_per_100g": 0.0,
      "unit": "\u00b5g",
      "amount_notes": "Auto-imported from USDA FoodData Central",
      "is_beneficial": true
    },
    {
      "molecule_name": "Lutein + zeaxanthin",
      "amount_per_100g": 0.0,
      "unit": "\u00b5g",
      "amount_notes": "Auto-imported from USDA FoodData Central",
      "is_beneficial": true
    },
    {
      "molecule_name": "Lipids",
      "amount_per_100g": null,
      "unit": "g",
      "amount_notes": "Auto-imported from USDA FoodData Central",
      "is_beneficial": true
    },
    {
      "molecule_name": "Fatty acids, total saturated",
      "amount_per_100g": 7.9,
      "unit": "g",
      "amount_notes": "Auto-imported from USDA FoodData Central",
      "is_beneficial": true
    },
    {
      "molecule_name": "Cholesterol",
      "amount_per_100g": 64.0,
      "unit": "mg",
      "amount_notes": "Auto-imported from USDA FoodData Central",
      "is_beneficial": true
    },
    {
      "molecule_name": "Amino acids",
      "amount_per_100g": null,
      "unit": "g",
      "amount_notes": "Auto-imported from USDA FoodData Central",
      "is_beneficial": true
    },
    {
      "molecule_name": "Alcohol, ethyl",
      "amount_per_100g": 0.0,
      "unit": "g",
      "amount_notes": "Auto-imported from USDA FoodData Central",
      "is_beneficial": true
    },
    {
      "molecule_name": "Caffeine",
      "amount_per_100g": 0.0,
      "unit": "mg",
      "amount_notes": "Auto-imported from USDA FoodData Central",
      "is_beneficial": true
    },
    {
      "molecule_name": "Theobromine",
      "amount_per_100g": 0.0,
      "unit": "mg",
      "amount_notes": "Auto-imported from USDA FoodData Central",
      "is_beneficial": true
    }
  ]
}