{
  "id": "291644ad-c56a-438c-bcff-742e776fa38a",
  "name": "wild rice, dry, raw",
  "aliases": [],
  "category": "Cereal Grains and Pasta",
  "origin": "",
  "overall_safety_score": null,
  "health_index": null,
  "ban_listed": false,
  "image_url": "",
  "metadata": {
    "source": "USDA FoodData Central",
    "usda_fdc_id": 2710821,
    "data_type": "Foundation",
    "source_url": "https://fdc.nal.usda.gov/fdc-app.html#/food-details/2710821/nutrients"
  },
  "molecules": [
    {
      "molecule_name": "Proximates",
      "amount_per_100g": null,
      "unit": "g",
      "amount_notes": "Auto-imported from USDA FoodData Central",
      "is_beneficial": true
    },
    {
      "molecule_name": "Energy (Atwater General Factors)",
      "amount_per_100g": 369.164,
      "unit": "kcal",
      "amount_notes": "Auto-imported from USDA FoodData Central",
      "is_beneficial": true
    },
    {
      "molecule_name": "Energy (Atwater Specific Factors)",
      "amount_per_100g": 358.55263,
      "unit": "kcal",
      "amount_notes": "Auto-imported from USDA FoodData Central",
      "is_beneficial": true
    },
    {
      "molecule_name": "Protein",
      "amount_per_100g": 12.7875,
      "unit": "g",
      "amount_notes": "Auto-imported from USDA FoodData Central",
      "is_beneficial": true
    },
    {
      "molecule_name": "Total lipid (fat)",
      "amount_per_100g": 1.704,
      "unit": "g",
      "amount_notes": "Auto-imported from USDA FoodData Central",
      "is_beneficial": true
    },
    {
      "molecule_name": "Carbohydrates",
      "amount_per_100g": null,
      "unit": "g",
      "amount_notes": "Auto-imported from USDA FoodData Central",
      "is_beneficial": true
    },
    {
      "molecule_name": "Carbohydrate, by difference",
      "amount_per_100g": 75.6695,
      "unit": "g",
      "amount_notes": "Auto-imported from USDA FoodData Central",
      "is_beneficial": true
    },
    {
      "molecule_name": "Fiber, total dietary",
      "amount_per_100g": 4.26,
      "unit": "g",
      "amount_notes": "Auto-imported from USDA FoodData Central",
      "is_beneficial": true
    },
    {
      "molecule_name": "Starch",
      "amount_per_100g": 68.65,
      "unit": "g",
      "amount_notes": "Auto-imported from USDA FoodData Central",
      "is_beneficial": true
    },
    {
      "molecule_name": "Minerals",
      "amount_per_100g": null,
      "unit": "mg",
      "amount_notes": "Auto-imported from USDA FoodData Central",
      "is_beneficial": true
    },
    {
      "molecule_name": "Calcium, Ca",
      "amount_per_100g": 7.973,
      "unit": "mg",
      "amount_notes": "Auto-imported from USDA FoodData Central",
      "is_beneficial": true
    },
    {
      "molecule_name": "Iron, Fe",
      "amount_per_100g": 1.53,
      "unit": "mg",
      "amount_notes": "Auto-imported from USDA FoodData Central",
      "is_beneficial": true
    },
    {
      "molecule_name": "Magnesium, Mg",
      "amount_per_100g": 108.5,
      "unit": "mg",
      "amount_notes": "Auto-imported from USDA FoodData Central",
      "is_beneficial": true
    },
    {
      "molecule_name": "Phosphorus, P",
      "amount_per_100g": 354.9,
      "unit": "mg",
      "amount_notes": "Auto-imported from USDA FoodData Central",
      "is_beneficial": true
    },
    {
      "molecule_name": "Potassium, K",
      "amount_per_100g": 298.8,
      "unit": "mg",
      "amount_notes": "Auto-imported from USDA FoodData Central",
      "is_beneficial": true
    },
    {
      "molecule_name": "Sodium, Na",
      "amount_per_100g": 1.014,
      "unit": "mg",
      "amount_notes": "Auto-imported from USDA FoodData Central",
      "is_beneficial": true
    },
    {
      "molecule_name": "Zinc, Zn",
      "amount_per_100g": 5.845,
      "unit": "mg",
      "amount_notes": "Auto-imported from USDA FoodData Central",
      "is_beneficial": true
    },
    {
      "molecule_name": "Copper, Cu",
      "amount_per_100g": 0.487,
      "unit": "mg",
      "amount_notes": "Auto-imported from USDA FoodData Central",
      "is_beneficial": true
    },
    {
      "molecule_name": "Manganese, Mn",
      "amount_per_100g": 1.315,
      "unit": "mg",
      "amount_notes": "Auto-imported from USDA FoodData Central",
      "is_beneficial": true
    },
    {
      "molecule_name": "Vitamins and Other Components",
      "amount_per_100g": null,
      "unit": "g",
      "amount_notes": "Auto-imported from USDA FoodData Central",
      "is_beneficial": true
    },
    {
      "molecule_name": "Thiamin",
      "amount_per_100g": 0.3388,
      "unit": "mg",
      "amount_notes": "Auto-imported from USDA FoodData Central",
      "is_beneficial": true
    },
    {
      "molecule_name": "Niacin",
      "amount_per_100g": 6.914,
      "unit": "mg",
      "amount_notes": "Auto-imported from USDA FoodData Central",
      "is_beneficial": true
    },
    {
      "molecule_name": "Vitamin B-6",
      "amount_per_100g": 0.3934,
      "unit": "mg",
      "amount_notes": "Auto-imported from USDA FoodData Central",
      "is_beneficial": true
    },
    {
      "molecule_name": "Biotin",
      "amount_per_100g": 2.125,
      "unit": "\u00b5g",
      "amount_notes": "Auto-imported from USDA FoodData Central",
      "is_beneficial": true
    }
  ]
}