{
  "id": "ce5a61d2-6271-4621-a97e-7c61b59faa44",
  "name": "puddings, rice, dry mix",
  "aliases": [],
  "category": "Sweets",
  "origin": "",
  "overall_safety_score": null,
  "health_index": null,
  "ban_listed": false,
  "image_url": "",
  "metadata": {
    "source": "USDA FoodData Central",
    "usda_fdc_id": 168783,
    "data_type": "SR Legacy",
    "source_url": "https://fdc.nal.usda.gov/fdc-app.html#/food-details/168783/nutrients"
  },
  "molecules": [
    {
      "molecule_name": "Proximates",
      "amount_per_100g": null,
      "unit": "g",
      "amount_notes": "Auto-imported from USDA FoodData Central",
      "is_beneficial": true
    },
    {
      "molecule_name": "Energy",
      "amount_per_100g": 376.0,
      "unit": "kcal",
      "amount_notes": "Auto-imported from USDA FoodData Central",
      "is_beneficial": true
    },
    {
      "molecule_name": "Energy",
      "amount_per_100g": 1573.0,
      "unit": "kJ",
      "amount_notes": "Auto-imported from USDA FoodData Central",
      "is_beneficial": true
    },
    {
      "molecule_name": "Protein",
      "amount_per_100g": 2.7,
      "unit": "g",
      "amount_notes": "Auto-imported from USDA FoodData Central",
      "is_beneficial": true
    },
    {
      "molecule_name": "Total lipid (fat)",
      "amount_per_100g": 0.1,
      "unit": "g",
      "amount_notes": "Auto-imported from USDA FoodData Central",
      "is_beneficial": true
    },
    {
      "molecule_name": "Carbohydrates",
      "amount_per_100g": null,
      "unit": "g",
      "amount_notes": "Auto-imported from USDA FoodData Central",
      "is_beneficial": true
    },
    {
      "molecule_name": "Carbohydrate, by difference",
      "amount_per_100g": 91.2,
      "unit": "g",
      "amount_notes": "Auto-imported from USDA FoodData Central",
      "is_beneficial": true
    },
    {
      "molecule_name": "Fiber, total dietary",
      "amount_per_100g": 0.7,
      "unit": "g",
      "amount_notes": "Auto-imported from USDA FoodData Central",
      "is_beneficial": true
    },
    {
      "molecule_name": "Minerals",
      "amount_per_100g": null,
      "unit": "mg",
      "amount_notes": "Auto-imported from USDA FoodData Central",
      "is_beneficial": true
    },
    {
      "molecule_name": "Calcium, Ca",
      "amount_per_100g": 14.0,
      "unit": "mg",
      "amount_notes": "Auto-imported from USDA FoodData Central",
      "is_beneficial": true
    },
    {
      "molecule_name": "Iron, Fe",
      "amount_per_100g": 1.79,
      "unit": "mg",
      "amount_notes": "Auto-imported from USDA FoodData Central",
      "is_beneficial": true
    },
    {
      "molecule_name": "Magnesium, Mg",
      "amount_per_100g": 8.0,
      "unit": "mg",
      "amount_notes": "Auto-imported from USDA FoodData Central",
      "is_beneficial": true
    },
    {
      "molecule_name": "Phosphorus, P",
      "amount_per_100g": 39.0,
      "unit": "mg",
      "amount_notes": "Auto-imported from USDA FoodData Central",
      "is_beneficial": true
    },
    {
      "molecule_name": "Potassium, K",
      "amount_per_100g": 5.0,
      "unit": "mg",
      "amount_notes": "Auto-imported from USDA FoodData Central",
      "is_beneficial": true
    },
    {
      "molecule_name": "Sodium, Na",
      "amount_per_100g": 366.0,
      "unit": "mg",
      "amount_notes": "Auto-imported from USDA FoodData Central",
      "is_beneficial": true
    },
    {
      "molecule_name": "Zinc, Zn",
      "amount_per_100g": 0.31,
      "unit": "mg",
      "amount_notes": "Auto-imported from USDA FoodData Central",
      "is_beneficial": true
    },
    {
      "molecule_name": "Copper, Cu",
      "amount_per_100g": 0.062,
      "unit": "mg",
      "amount_notes": "Auto-imported from USDA FoodData Central",
      "is_beneficial": true
    },
    {
      "molecule_name": "Manganese, Mn",
      "amount_per_100g": 0.3,
      "unit": "mg",
      "amount_notes": "Auto-imported from USDA FoodData Central",
      "is_beneficial": true
    },
    {
      "molecule_name": "Selenium, Se",
      "amount_per_100g": 0.5,
      "unit": "\u00b5g",
      "amount_notes": "Auto-imported from USDA FoodData Central",
      "is_beneficial": true
    },
    {
      "molecule_name": "Vitamins and Other Components",
      "amount_per_100g": null,
      "unit": "g",
      "amount_notes": "Auto-imported from USDA FoodData Central",
      "is_beneficial": true
    },
    {
      "molecule_name": "Vitamin C, total ascorbic acid",
      "amount_per_100g": 0.0,
      "unit": "mg",
      "amount_notes": "Auto-imported from USDA FoodData Central",
      "is_beneficial": true
    },
    {
      "molecule_name": "Thiamin",
      "amount_per_100g": 0.248,
      "unit": "mg",
      "amount_notes": "Auto-imported from USDA FoodData Central",
      "is_beneficial": true
    },
    {
      "molecule_name": "Riboflavin",
      "amount_per_100g": 0.012,
      "unit": "mg",
      "amount_notes": "Auto-imported from USDA FoodData Central",
      "is_beneficial": true
    },
    {
      "molecule_name": "Niacin",
      "amount_per_100g": 2.013,
      "unit": "mg",
      "amount_notes": "Auto-imported from USDA FoodData Central",
      "is_beneficial": true
    },
    {
      "molecule_name": "Pantothenic acid",
      "amount_per_100g": 0.108,
      "unit": "mg",
      "amount_notes": "Auto-imported from USDA FoodData Central",
      "is_beneficial": true
    },
    {
      "molecule_name": "Vitamin B-6",
      "amount_per_100g": 0.013,
      "unit": "mg",
      "amount_notes": "Auto-imported from USDA FoodData Central",
      "is_beneficial": true
    },
    {
      "molecule_name": "Folate, total",
      "amount_per_100g": 1.0,
      "unit": "\u00b5g",
      "amount_notes": "Auto-imported from USDA FoodData Central",
      "is_beneficial": true
    },
    {
      "molecule_name": "Folic acid",
      "amount_per_100g": 0.0,
      "unit": "\u00b5g",
      "amount_notes": "Auto-imported from USDA FoodData Central",
      "is_beneficial": true
    },
    {
      "molecule_name": "Folate, food",
      "amount_per_100g": 1.0,
      "unit": "\u00b5g",
      "amount_notes": "Auto-imported from USDA FoodData Central",
      "is_beneficial": true
    },
    {
      "molecule_name": "Folate, DFE",
      "amount_per_100g": 1.0,
      "unit": "\u00b5g",
      "amount_notes": "Auto-imported from USDA FoodData Central",
      "is_beneficial": true
    },
    {
      "molecule_name": "Vitamin B-12",
      "amount_per_100g": 0.0,
      "unit": "\u00b5g",
      "amount_notes": "Auto-imported from USDA FoodData Central",
      "is_beneficial": true
    },
    {
      "molecule_name": "Vitamin B-12, added",
      "amount_per_100g": 0.0,
      "unit": "\u00b5g",
      "amount_notes": "Auto-imported from USDA FoodData Central",
      "is_beneficial": true
    },
    {
      "molecule_name": "Vitamin A, RAE",
      "amount_per_100g": 0.0,
      "unit": "\u00b5g",
      "amount_notes": "Auto-imported from USDA FoodData Central",
      "is_beneficial": true
    },
    {
      "molecule_name": "Retinol",
      "amount_per_100g": 0.0,
      "unit": "\u00b5g",
      "amount_notes": "Auto-imported from USDA FoodData Central",
      "is_beneficial": true
    },
    {
      "molecule_name": "Vitamin A, IU",
      "amount_per_100g": 0.0,
      "unit": "IU",
      "amount_notes": "Auto-imported from USDA FoodData Central",
      "is_beneficial": true
    },
    {
      "molecule_name": "Lipids",
      "amount_per_100g": null,
      "unit": "g",
      "amount_notes": "Auto-imported from USDA FoodData Central",
      "is_beneficial": true
    },
    {
      "molecule_name": "Cholesterol",
      "amount_per_100g": 0.0,
      "unit": "mg",
      "amount_notes": "Auto-imported from USDA FoodData Central",
      "is_beneficial": true
    }
  ]
}